{
  "$schema": "./exam.schema.json",
  "id": "system-programming-2026-2",
  "title": "시스템프로그래밍 객관식 암기 문제집",
  "course": "시스템프로그래밍 · 2026-2학기",
  "description": "시험 범위(리눅스 명령어 · 파이프/리다이렉션 · GCC와 개발 도구(objdump, strace) · 주요 코드 예제 13개)를 객관식으로 외운다. 1·2·3·4·6장 강의자료와 '리눅스 명령어 기초' 자료가 출처이며, 예제 문항은 실제 실행 결과로 검증했다.",
  "tags": [
    "시스템프로그래밍",
    "리눅스",
    "명령어",
    "파일 입출력",
    "gcc",
    "strace",
    "암기"
  ],
  "updated": "2026-10-30",
  "sections": [
    {
      "id": "L01",
      "title": "명령어 구조 · 파일과 디렉터리",
      "questions": [
        {
          "id": "L01-01",
          "type": "개념",
          "prompt": "명령 `ls -l /home`의 구성 요소에 대한 설명으로 옳은 것은?",
          "choices": [
            "`-l`은 인자로 적용 대상을 지정하고, `/home`은 옵션으로 출력 방식을 바꾼다",
            "`ls`는 옵션이고, `-l`이 실행할 명령어다",
            "`/home`은 실행 결과를 저장할 파일 이름이다",
            "`-l`은 옵션으로 출력 방식을 바꾸고, `/home`은 인자로 적용 대상을 지정한다"
          ],
          "answer": 4,
          "explanation": "형식은 `명령어 [옵션] [인자]`. 옵션은 출력 방식·동작을 바꾸고, 인자는 명령이 실제로 적용되는 대상(경로)이다."
        },
        {
          "id": "L01-02",
          "type": "비교",
          "prompt": "명령어 도움말을 보는 두 방법 `명령어 --help`와 `man 명령어`의 차이로 옳은 것은?",
          "choices": [
            "`--help`는 상세한 매뉴얼을, `man`은 한 줄 요약만 보여 준다",
            "`--help`는 관리자 권한이 있어야 실행된다",
            "`--help`는 간단한 요약을, `man`은 상세한 매뉴얼 페이지를 보여 준다",
            "`man`은 셸 내장 명령에만 쓸 수 있다"
          ],
          "answer": 3,
          "explanation": "`--help`는 옵션 요약, `man`은 섹션별로 정리된 자세한 매뉴얼(man 페이지)이다."
        },
        {
          "id": "L01-03",
          "type": "개념",
          "prompt": "`pwd -P`를 실행하면 출력되는 것은?",
          "choices": [
            "심볼릭 링크를 해석한 실제(물리적) 경로",
            "바로 위 상위 디렉터리의 경로",
            "로그인한 사용자의 홈 디렉터리 경로",
            "직전에 있던 디렉터리의 경로"
          ],
          "answer": 1,
          "explanation": "`pwd`는 현재 작업 디렉터리의 절대 경로를, `-P`는 심볼릭 링크를 따라간 물리적 경로를 보여 준다."
        },
        {
          "id": "L01-04",
          "type": "코드",
          "prompt": "숨김 파일을 포함해 상세 정보와 사람이 읽기 쉬운 크기(KB·MB)로 목록을 보는 명령은?",
          "choices": [
            "`ls -l`",
            "`ls -alh`",
            "`ls -ah`",
            "`ls -li`"
          ],
          "answer": 2,
          "explanation": "`-a` 숨김 파일 포함 + `-l` 상세 정보 + `-h` 읽기 쉬운 크기. 옵션은 `-alh`처럼 묶어 쓸 수 있다."
        },
        {
          "id": "L01-05",
          "type": "개념",
          "prompt": "`ls -l` 출력에서 맨 앞 글자가 `l`인 항목은?",
          "choices": [
            "심볼릭 링크",
            "디렉터리",
            "일반 파일",
            "블록 장치 파일"
          ],
          "answer": 1,
          "explanation": "첫 글자는 파일 종류다. `-` 일반 파일, `d` 디렉터리, `l` 심볼릭 링크, `b` 블록 장치, `c` 문자 장치."
        },
        {
          "id": "L01-06",
          "type": "코드",
          "prompt": "현재 디렉터리의 **하위 폴더만** 깔끔하게 나열하는 명령은?",
          "choices": [
            "`ls -a`",
            "`ls -l .`",
            "`ls ..`",
            "`ls -d */`"
          ],
          "answer": 4,
          "explanation": "`*/`는 디렉터리만 고르는 패턴이고, `-d`는 그 디렉터리의 내용 대신 이름 자체를 보여 준다."
        },
        {
          "id": "L01-07",
          "type": "코드",
          "prompt": "직전에 있던 디렉터리로 되돌아가는 명령은?",
          "choices": [
            "`cd ..`",
            "`cd -`",
            "`cd ~`",
            "`cd /`"
          ],
          "answer": 2,
          "explanation": "`cd -`는 바로 이전 디렉터리, `cd ..`는 상위 디렉터리, `cd ~`는 홈 디렉터리, `cd /`는 루트로 이동한다."
        },
        {
          "id": "L01-08",
          "type": "옳지 않은 것",
          "prompt": "경로에 대한 설명으로 옳지 **않은** 것은?",
          "choices": [
            "절대 경로는 루트(/)부터 대상까지의 전체 경로를 쓴다",
            "상대 경로에서 `.`은 현재 디렉터리, `..`은 상위 디렉터리를 뜻한다",
            "상대 경로는 루트(/)부터 시작하므로 어느 위치에서 실행해도 같은 대상을 가리킨다",
            "`~`는 홈 디렉터리를 뜻하므로 `cd ~/linux-lab`은 홈 아래 linux-lab으로 이동한다"
          ],
          "answer": 3,
          "explanation": "루트부터 쓰고 어디서든 같게 동작하는 것은 **절대 경로**다. 상대 경로는 현재 작업 디렉터리를 기준으로 해석된다."
        },
        {
          "id": "L01-09",
          "type": "코드",
          "prompt": "존재하지 않는 중간 경로까지 한 번에 만들어 `project/src/test`를 생성하는 명령은?",
          "choices": [
            "`mkdir project/src/test`",
            "`mkdir -r project/src/test`",
            "`touch -p project/src/test`",
            "`mkdir -p project/src/test`"
          ],
          "answer": 4,
          "explanation": "`-p`는 필요한 부모 디렉터리를 자동으로 만든다. `-p` 없이 실행하면 project/src가 없을 때 오류가 난다."
        },
        {
          "id": "L01-10",
          "type": "개념",
          "prompt": "파일이 들어 있는 디렉터리 `dir1`에 `rmdir dir1`을 실행하면?",
          "choices": [
            "비어 있지 않으므로 오류가 나고 삭제되지 않는다",
            "안의 파일까지 모두 삭제된다",
            "안의 파일은 상위 디렉터리로 옮겨지고 dir1만 삭제된다",
            "삭제 여부를 묻는 확인 메시지가 나온다"
          ],
          "answer": 1,
          "explanation": "`rmdir`은 **빈 디렉터리만** 삭제한다. 내용까지 지우려면 `rm -r dir1`을 쓴다."
        },
        {
          "id": "L01-11",
          "type": "개념",
          "prompt": "이미 내용이 있는 `note.txt`에 `touch note.txt`를 실행한 결과는?",
          "choices": [
            "내용이 지워져 크기가 0인 파일이 된다",
            "같은 이름의 파일이 있다는 오류가 난다",
            "내용은 그대로 두고 접근·수정 시간만 현재 시각으로 갱신된다",
            "note.txt.bak 백업 파일이 새로 생긴다"
          ],
          "answer": 3,
          "explanation": "`touch`는 파일이 없으면 크기 0인 빈 파일을 만들고, 있으면 타임스탬프만 갱신한다."
        },
        {
          "id": "L01-12",
          "type": "코드",
          "prompt": "디렉터리 `dir1`을 하위 내용까지 통째로 `dir2`로 복사하는 명령은?",
          "choices": [
            "`cp dir1 dir2`",
            "`cp -r dir1 dir2`",
            "`mv -r dir1 dir2`",
            "`cp -i dir1 dir2`"
          ],
          "answer": 2,
          "explanation": "`-r`(recursive)이 디렉터리와 그 하위 내용을 재귀적으로 복사한다. `-r` 없이 디렉터리를 복사하면 오류가 난다."
        },
        {
          "id": "L01-13",
          "type": "개념",
          "prompt": "`cp`·`mv`·`rm`에서 덮어쓰기·삭제 전에 **확인을 요청**하게 하는 공통 옵션은?",
          "choices": [
            "`-i`",
            "`-r`",
            "`-f`",
            "`-a`"
          ],
          "answer": 1,
          "explanation": "`-i`(interactive)는 대상마다 확인을 묻는다. `cp`는 기본적으로 확인 없이 덮어쓰므로 주의한다. `-f`는 반대로 묻지 않고 강제로 처리한다."
        },
        {
          "id": "L01-14",
          "type": "옳지 않은 것",
          "prompt": "`mv` 명령에 대한 설명으로 옳지 **않은** 것은?",
          "choices": [
            "`mv old.txt new.txt`처럼 같은 디렉터리 안에서 쓰면 이름 변경이 된다",
            "`mv new.txt archive/`는 파일을 archive 디렉터리로 옮긴다",
            "같은 파일 시스템 안에서도 데이터를 전부 복사한 뒤 원본을 지우므로 대용량 파일은 느리다",
            "이동할 위치에 같은 이름이 있으면 덮어쓰며, `-i`로 확인을 받을 수 있다"
          ],
          "answer": 3,
          "explanation": "같은 파일 시스템 안의 `mv`는 데이터를 복사하지 않고 **위치 정보만** 바꾸므로 대용량 파일도 빠르다."
        },
        {
          "id": "L01-15",
          "type": "개념",
          "prompt": "`rm -rf directory/`의 동작은?",
          "choices": [
            "빈 디렉터리일 때만 삭제한다",
            "삭제하기 전에 항목마다 확인을 묻는다",
            "삭제한 내용을 휴지통으로 옮겨 나중에 복구할 수 있다",
            "확인 없이 디렉터리와 내부 내용을 재귀적으로 강제 삭제한다"
          ],
          "answer": 4,
          "explanation": "`-r` 재귀 + `-f` 강제. 리눅스 `rm`으로 지운 파일은 휴지통으로 가지 않아 복구가 어렵다."
        },
        {
          "id": "L01-16",
          "type": "코드",
          "prompt": "현재 디렉터리부터 하위까지 확장자가 `.log`인 파일을 모두 찾는 명령은?",
          "choices": [
            "`find \"*.log\" -name .`",
            "`find . -name \"*.log\"`",
            "`find . -type \"*.log\"`",
            "`grep -n \"*.log\" .`"
          ],
          "answer": 2,
          "explanation": "형식은 `find [시작경로] [조건]`. 이름 조건은 `-name`이고 패턴은 따옴표로 감싸는 것이 안전하다."
        },
        {
          "id": "L01-17",
          "type": "짝",
          "prompt": "`find`의 `-type` 조건과 찾는 대상의 연결이 옳은 것은?",
          "choices": [
            "`-type d` 디렉터리 · `-type f` 일반 파일 · `-type l` 심볼릭 링크",
            "`-type d` 장치 파일 · `-type f` 폴더 · `-type l` 로그 파일",
            "`-type d` 삭제된 파일 · `-type f` 빈 파일 · `-type l` 긴 파일",
            "`-type d` 디렉터리 · `-type f` FIFO 파일 · `-type l` 라이브러리"
          ],
          "answer": 1,
          "explanation": "d = directory, f = file, l = link. 빈 파일은 `-type f -empty`로 찾는다."
        },
        {
          "id": "L01-18",
          "type": "코드",
          "prompt": "크기가 **10KB 미만**인 파일을 찾는 `find` 조건은?",
          "choices": [
            "`-size +10k`",
            "`-mtime -10`",
            "`-empty -10k`",
            "`-size -10k`"
          ],
          "answer": 4,
          "explanation": "`-size +100M`은 100MB보다 큰 파일, `-size -10k`는 10KB 미만. `+`·`-`로 범위를 정한다."
        },
        {
          "id": "L01-19",
          "type": "코드",
          "prompt": "현재 위치 아래에서 크기가 0바이트인 **빈 일반 파일**을 찾는 명령은?",
          "choices": [
            "`find . -type d -empty`",
            "`find . -size +0`",
            "`find . -type f -empty`",
            "`find . -name empty`"
          ],
          "answer": 3,
          "explanation": "`-type f`로 일반 파일만 고르고 `-empty`로 크기 0인 것을 고른다. `-type d -empty`는 빈 디렉터리다."
        },
        {
          "id": "L01-20",
          "type": "개념",
          "prompt": "`find /home -user alice`가 찾는 것은?",
          "choices": [
            "/home 아래에서 이름에 alice가 들어간 파일",
            "/home 아래에서 소유자가 alice인 파일과 디렉터리",
            "alice가 최근 7일 동안 수정한 파일",
            "alice 계정으로 로그인한 터미널 목록"
          ],
          "answer": 2,
          "explanation": "`-user`는 소유자 조건이다. 이름은 `-name`, 최근 수정 시각은 `-mtime -7` 같은 조건으로 찾는다."
        },
        {
          "id": "L01-21",
          "type": "코드",
          "prompt": "사용자 han01의 홈 디렉터리로 이동하는 명령은?",
          "choices": [
            "`cd ~han01`",
            "`cd -han01`",
            "`cd ../han01/~`",
            "`cd /han01`"
          ],
          "answer": 1,
          "explanation": "`~사용자명`은 그 사용자의 홈 디렉터리다(기본 명령 표의 예: `cd ~han01`)."
        },
        {
          "id": "L01-22",
          "type": "개념",
          "prompt": "리눅스에서 **숨김 파일**로 간주되는 파일 이름은?",
          "choices": [
            "`bashrc~`",
            "`_bashrc`",
            "`.bashrc`",
            "`#bashrc`"
          ],
          "answer": 3,